{
  "bundleKind": "core-release",
  "repo": "git@gitlab.com:fd.skyrealm/air-core.git",
  "branch": "main",
  "commit": "<full git commit>",
  "dirtyTree": "no",
  "releaseAllowed": "yes",
  "npmPackage": "@underskys/air-core",
  "packageVersion": "0.44.2",
  "airAbi": "0.10",
  "hostAbi": "0.11 latest, limited to bounded output.emit; 0.10 baseline supported",
  "internalSlice": "M45-S1",
  "publicVersion": "0.45.0",
  "includedPaths": [
    "README.md",
    "package.json",
    "bin/",
    "src/",
    "spec/",
    "stdlib/"
  ],
  "excludedPaths": [
    "node_modules/",
    "*.tgz",
    "REVIEW_RESULTS/",
    "snapshots/",
    "prompts/",
    "demo/",
    "demos/",
    "consumer_evidence/"
  ],
  "checksRun": [
    "npm test",
    "npm run check:public-package-surface",
    "npm run check:release-lane"
  ],
  "knownLimitations": []
}
